Ipc-image Image,Ipc-image Image.1,Ipc-lockup-overlay URL,Title,Title.1,Ipc-inline-list__item,Ipc-inline-list__item.1,Rating,Rating.1,Ipc-html-content-inner-div,Ipc-inline-list__item.2,Sc-9fe7b0ef-0,genre,image_path,download_error,valid_image
"https://m.media-amazon.com/images/M/MV5BNGYyMDRhYTgtMjIzNy00OGQyLTk4MTEtZTM2ODlmNjc0NTlhXkEyXkFqcGc@._V1_QL75_UX180_CR0,3,180,266_.jpg","Klaus Kinski in Aguirre, the Wrath of God (1972)",https://www.imdb.com/title/tt0068182/?ref_=sr_i_758,https://www.imdb.com/title/tt0068182/?ref_=sr_t_758,"758. Aguirre, the Wrath of God",1972,1h 35m,7.8,( 68K ),"In the 16th century, the ruthless and insane Don Lope de Aguirre leads a Spanish expedition in search of El Dorado.",Not Rated,,Drama_Crime,images\757.jpg,,True
"https://m.media-amazon.com/images/M/MV5BOTMyMmYzZDEtMDYwMC00N2EwLTg1NmMtMzk0YTMzODUxYzFmXkEyXkFqcGc@._V1_QL75_UY266_CR0,0,180,266_.jpg","Jasna Đuričić in Quo Vadis, Aida? (2020)",https://www.imdb.com/title/tt8633462/?ref_=sr_i_481,https://www.imdb.com/title/tt8633462/?ref_=sr_t_481,"481. Quo Vadis, Aida?",2020,1h 41m,8.0,( 42K ),"Aida is a translator for the UN in the small town of Srebrenica. When the Serbian army takes over the town, her family is among the thousands of citizens looking for shelter in the UN camp.",TV-MA,97.0,Action_Adventure,images\480.jpg,,True
"https://m.media-amazon.com/images/M/MV5BMGZiZDVjNzYtZWM4ZC00MzVkLThhNDEtMDJlOTBhYzVjMmNhXkEyXkFqcGc@._V1_QL75_UX180_CR0,1,180,266_.jpg",Daniel Day-Lewis in In the Name of the Father (1993),https://www.imdb.com/title/tt0107207/?ref_=sr_i_284,https://www.imdb.com/title/tt0107207/?ref_=sr_t_284,284. In the Name of the Father,1993,2h 13m,8.1,( 202K ),"An Irish man's coerced confession to an I.R.A. bombing he did not commit results in the imprisonment of his father as well. Meanwhile, a British lawyer fights to clear their names and free them.",R,84.0,Action_Adventure,images\283.jpg,,True
"https://m.media-amazon.com/images/M/MV5BNzljMjA3MTQtMjM1OS00OGJjLWJiYzctZDRiMTk1NWI5YzQ5XkEyXkFqcGc@._V1_QL75_UX180_CR0,0,180,266_.jpg",Ghost in the Shell (1995),https://www.imdb.com/title/tt0113568/?ref_=sr_i_537,https://www.imdb.com/title/tt0113568/?ref_=sr_t_537,537. Ghost in the Shell,1995,1h 23m,7.9,( 173K ),A cyborg policewoman and her partner hunt a mysterious and powerful hacker called the Puppet Master.,TV-MA,76.0,Drama_Crime,images\536.jpg,,True
"https://m.media-amazon.com/images/M/MV5BNTgwODM5OTMzN15BMl5BanBnXkFtZTcwMTA3NzI1Nw@@._V1_QL75_UY266_CR2,0,180,266_.jpg",Irrfan Khan in Paan Singh Tomar (2012),https://www.imdb.com/title/tt1620933/?ref_=sr_i_226,https://www.imdb.com/title/tt1620933/?ref_=sr_t_226,226. Paan Singh Tomar,2012,2h 15m,8.2,( 40K ),"The story of Paan Singh Tomar, an Indian athlete and seven-time national steeplechase champion who becomes one of the most feared criminals in Chambal Valley after his retirement.",Not Rated,,Action_Adventure,images\225.jpg,,True
"https://m.media-amazon.com/images/M/MV5BYjY4NGI5OTUtY2ZlZS00Zjk4LTk5N2MtN2JmYWVjNGNmMGRlXkEyXkFqcGc@._V1_QL75_UY266_CR0,0,180,266_.jpg",Inhabitants of Belo Vale Boa Morte and Cidade de Congonhas and Paige Ellens in City of God (2002),https://www.imdb.com/title/tt0317248/?ref_=sr_i_27,https://www.imdb.com/title/tt0317248/?ref_=sr_t_27,27. City of God,2002,2h 10m,8.6,( 869K ),"In the slums of Rio, two kids' paths diverge as one struggles to become a photographer and the other a kingpin.",R,79.0,Animation_Family,images\26.jpg,,True
"https://m.media-amazon.com/images/M/MV5BYmMyYjBmMzAtOWUzOC00YjU2LThmYTgtY2ZhMjM0MWM5MWI5XkEyXkFqcGc@._V1_QL75_UX180_CR0,5,180,266_.jpg",Veronica Lake in Sullivan's Travels (1941),https://www.imdb.com/title/tt0034240/?ref_=sr_i_631,https://www.imdb.com/title/tt0034240/?ref_=sr_t_631,631. Sullivan's Travels,1941,1h 30m,7.9,( 31K ),Hollywood director John L. Sullivan sets out to experience life as a homeless person in order to gain relevant life experience for his next movie.,Approved,89.0,Drama_Crime,images\630.jpg,,True
"https://m.media-amazon.com/images/M/MV5BMmQ0MjAwOGUtZjUzNy00MzQ1LWJkZGYtNWNhOGVjNzA2MTRjXkEyXkFqcGc@._V1_QL75_UX180_CR0,5,180,266_.jpg",Bette Davis and Joan Crawford in What Ever Happened to Baby Jane? (1962),https://www.imdb.com/title/tt0056687/?ref_=sr_i_438,https://www.imdb.com/title/tt0056687/?ref_=sr_t_438,438. What Ever Happened to Baby Jane?,1962,2h 14m,8.0,( 68K ),"A former vaudeville child star torments her paraplegic sister, who eclipsed her as a movie star, in their decaying Hollywood mansion while desperately clinging to hopes of a comeback.",Approved,75.0,Horror_Thriller,images\437.jpg,,True
"https://m.media-amazon.com/images/M/MV5BYzYyN2FiZmUtYWYzMy00MzViLWJkZTMtOGY1ZjgzNWMwN2YxXkEyXkFqcGc@._V1_QL75_UX180_CR0,1,180,266_.jpg","Leonardo DiCaprio, Kate Winslet, Billy Zane, Kathy Bates, and Frances Fisher in Titanic (1997)",https://www.imdb.com/title/tt0120338/?ref_=sr_i_365,https://www.imdb.com/title/tt0120338/?ref_=sr_t_365,365. Titanic,1997,3h 14m,8.0,( 1.4M ),"A seventeen-year-old aristocrat falls in love with a kind but poor artist aboard the luxurious, ill-fated R.M.S. Titanic.",PG-13,75.0,Romance,images\364.jpg,,True
"https://m.media-amazon.com/images/M/MV5BZDRkODJhOTgtOTc1OC00NTgzLTk4NjItNDgxZDY4YjlmNDY2XkEyXkFqcGc@._V1_QL75_UX180_CR0,0,180,266_.jpg",Charlize Theron and Tom Hardy in Mad Max: Fury Road (2015),https://www.imdb.com/title/tt1392190/?ref_=sr_i_230,https://www.imdb.com/title/tt1392190/?ref_=sr_t_230,230. Mad Max: Fury Road,2015,2h,8.1,( 1.2M ),"In a post-apocalyptic wasteland, a woman rebels against a tyrannical ruler in search for her homeland with the aid of a group of female prisoners, a psychotic worshipper and a drifter named Max.",R,90.0,Drama_Crime,images\229.jpg,,True
"https://m.media-amazon.com/images/M/MV5BZTU5NTNmMjAtODM0Mi00YzU5LTk1OWQtZWU1NzZhMzBjYjY1XkEyXkFqcGc@._V1_QL75_UX180_CR0,17,180,266_.jpg","Paresh Rawal, Urvashi, Suriya, and Aparna Balamurali in Soorarai Pottru (2020)",https://www.imdb.com/title/tt10189514/?ref_=sr_i_38,https://www.imdb.com/title/tt10189514/?ref_=sr_t_38,38. Soorarai Pottru,2020,2h 33m,8.6,( 132K ),"A determined villager challenges the aviation industry's elite by pursuing his vision of affordable air travel for all, despite numerous obstacles and setbacks",,,Drama_Crime,images\37.jpg,,True
"https://m.media-amazon.com/images/M/MV5BNTdmOWViYWMtMjVjNC00MDI5LTk3ZmEtM2MxMzFkMzQ5NzNjXkEyXkFqcGc@._V1_QL75_UX180_CR0,4,180,266_.jpg","Mia Farrow, Barbara Hershey, and Dianne Wiest in Hannah and Her Sisters (1986)",https://www.imdb.com/title/tt0091167/?ref_=sr_i_780,https://www.imdb.com/title/tt0091167/?ref_=sr_t_780,780. Hannah and Her Sisters,1986,1h 47m,7.8,( 81K ),"Between two Thanksgivings two years apart, Hannah's husband falls in love with her sister Lee, while her hypochondriac ex-husband rekindles his relationship with her sister Holly.",PG-13,90.0,Romance,images\779.jpg,,True
"https://m.media-amazon.com/images/M/MV5BMDQwNDY0M2MtOGFmNy00ZjI5LTkzN2ItMzg5M2IwZTZjY2MyXkEyXkFqcGc@._V1_QL75_UX180_CR0,1,180,266_.jpg","Brad Pitt, Bruce Willis, and Madeleine Stowe in 12 Monkeys (1995)",https://www.imdb.com/title/tt0114746/?ref_=sr_i_375,https://www.imdb.com/title/tt0114746/?ref_=sr_t_375,375. 12 Monkeys,1995,2h 9m,8.0,( 679K ),"In a future world devastated by disease, a convict is sent back in time to gather information about the man-made virus that wiped out most of the human population on the planet.",R,75.0,Sci_Fi,images\374.jpg,,True
"https://m.media-amazon.com/images/M/MV5BNTU1NTY2Mzg5M15BMl5BanBnXkFtZTgwNDcwNjM5MTE@._V1_QL75_UY266_CR8,0,180,266_.jpg",Haluk Bilginer and Melisa Sözen in Winter Sleep (2014),https://www.imdb.com/title/tt2758880/?ref_=sr_i_470,https://www.imdb.com/title/tt2758880/?ref_=sr_t_470,470. Winter Sleep,2014,3h 16m,8.0,( 59K ),A hotel owner and landlord in a remote Turkish village deals with conflicts within his family and a tenant behind on his rent.,Not Rated,88.0,Animation_Family,images\469.jpg,,True
"https://m.media-amazon.com/images/M/MV5BZDk4ZTMyZTktMjUxMC00ZTMwLTg3MDQtMjAyNTMxMTJjYjZiXkEyXkFqcGc@._V1_QL75_UX180_CR0,2,180,266_.jpg","Louis Hofmann, Emil Belton, and Zoe Zandvliet in Land of Mine (2015)",https://www.imdb.com/title/tt3841424/?ref_=sr_i_772,https://www.imdb.com/title/tt3841424/?ref_=sr_t_772,772. Land of Mine,2015,1h 40m,7.8,( 49K ),"In post-World War II Denmark, a group of young German POWs are forced to clear a beach of thousands of land mines under the watch of a Danish Sergeant who slowly learns to appreciate their plight.",R,75.0,Action_Adventure,images\771.jpg,,True
"https://m.media-amazon.com/images/M/MV5BZWY0NzgxMWQtMjM4NC00MjRiLWE0YjctYTFiNjA2NTNkZGY1XkEyXkFqcGc@._V1_QL75_UY266_CR1,0,180,266_.jpg",Denzel Washington in Remember the Titans (2000),https://www.imdb.com/title/tt0210945/?ref_=sr_i_683,https://www.imdb.com/title/tt0210945/?ref_=sr_t_683,683. Remember the Titans,2000,1h 53m,7.8,( 249K ),"In 1971, Virginia high-school football was everything to the people of Alexandria, but when the school board was forced to integrate an all-Black school with an all-White one, the foundation of football's tradition was put to the test.",PG,48.0,Drama_Crime,images\682.jpg,,True
"https://m.media-amazon.com/images/M/MV5BYjVlNTk3NGYtOWE0OC00MDI4LThlZWItZGMwMTdmYzcwM2Y5XkEyXkFqcGc@._V1_QL75_UX180_CR0,6,180,266_.jpg","Sean Connery, Kevin Costner, Robert De Niro, Andy Garcia, and Charles Martin Smith in The Untouchables (1987)",https://www.imdb.com/title/tt0094226/?ref_=sr_i_695,https://www.imdb.com/title/tt0094226/?ref_=sr_t_695,695. The Untouchables,1987,1h 59m,7.8,( 354K ),"During Prohibition, Treasury agent Eliot Ness sets out to stop ruthless Chicago gangster Al Capone, and assembles a small, incorruptible team to help him.",R,79.0,Action_Adventure,images\694.jpg,,True
"https://m.media-amazon.com/images/M/MV5BNTRmOTcyYmYtMTIwNi00ZGYyLTk4YjYtZGJlZTgwZGY0NGQyXkEyXkFqcGc@._V1_QL75_UX180_CR0,3,180,266_.jpg",Clint Eastwood and Lee Van Cleef in For a Few Dollars More (1965),https://www.imdb.com/title/tt0059578/?ref_=sr_i_195,https://www.imdb.com/title/tt0059578/?ref_=sr_t_195,195. For a Few Dollars More,1965,2h 12m,8.2,( 300K ),Two bounty killers with similar intentions but different motivations team up to take down a psychotic Mexican outlaw before he and his gang can carry out an audacious bank robbery.,R,74.0,Horror_Thriller,images\194.jpg,,True
"https://m.media-amazon.com/images/M/MV5BMzU0NDY0NDEzNV5BMl5BanBnXkFtZTgwOTIxNDU1MDE@._V1_QL75_UY266_CR0,0,180,266_.jpg","Ian McKellen, Richard Armitage, Orlando Bloom, Martin Freeman, Lee Pace, Benedict Cumberbatch, Evangeline Lilly, and Luke Evans in The Hobbit: The Desolation of Smaug (2013)",https://www.imdb.com/title/tt1170358/?ref_=sr_i_685,https://www.imdb.com/title/tt1170358/?ref_=sr_t_685,685. The Hobbit: The Desolation of Smaug,2013,2h 41m,7.8,( 752K ),"The dwarves, along with Bilbo Baggins and Gandalf the Grey, continue their quest to reclaim the Lonely Mountain, their homeland, from the dragon Smaug.",PG-13,66.0,Action_Adventure,images\684.jpg,,True
"https://m.media-amazon.com/images/M/MV5BM2Q1ZGZiNTYtMWNjOC00NmU2LTg1MDQtZGZkNmY0Y2RlOTBmXkEyXkFqcGc@._V1_QL75_UX180_CR0,0,180,266_.jpg",I Saw the Devil (2010),https://www.imdb.com/title/tt1588170/?ref_=sr_i_694,https://www.imdb.com/title/tt1588170/?ref_=sr_t_694,694. I Saw the Devil,2010,2h 24m,7.8,( 165K ),A secret agent exacts revenge on a serial killer through a series of captures and releases.,Not Rated,67.0,Horror_Thriller,images\693.jpg,,True
"https://m.media-amazon.com/images/M/MV5BYTNhNmY0YWMtMTczYi00MTA0LThhMmUtMTIxYzE0Y2QwMzRlXkEyXkFqcGc@._V1_QL75_UX180_CR0,7,180,266_.jpg",Henry Thomas and Pat Welsh in E.T. the Extra-Terrestrial (1982),https://www.imdb.com/title/tt0083866/?ref_=sr_i_504,https://www.imdb.com/title/tt0083866/?ref_=sr_t_504,504. E.T. the Extra-Terrestrial,1982,1h 55m,7.9,( 471K ),A troubled child summons the courage to help a friendly alien escape from Earth and return to his home planet.,PG,92.0,Sci_Fi,images\503.jpg,,True
"https://m.media-amazon.com/images/M/MV5BMTQ4NTMzMTk4NV5BMl5BanBnXkFtZTgwNTU5MjE4MDI@._V1_QL75_UX180_CR0,0,180,266_.jpg","Dave Johns in I, Daniel Blake (2016)",https://www.imdb.com/title/tt5168192/?ref_=sr_i_774,https://www.imdb.com/title/tt5168192/?ref_=sr_t_774,"774. I, Daniel Blake",2016,1h 40m,7.8,( 68K ),"After surviving a heart-attack, a 59-year-old carpenter must fight bureaucratic forces to receive Employment and Support Allowance.",R,78.0,Action_Adventure,images\773.jpg,,True
"https://m.media-amazon.com/images/M/MV5BMTYxMjk0NDg4Ml5BMl5BanBnXkFtZTgwODcyNjA5OTE@._V1_QL75_UX180_CR0,0,180,266_.jpg",Casey Affleck and Michelle Williams in Manchester by the Sea (2016),https://www.imdb.com/title/tt4034228/?ref_=sr_i_670,https://www.imdb.com/title/tt4034228/?ref_=sr_t_670,670. Manchester by the Sea,2016,2h 17m,7.8,( 356K ),A depressed uncle is asked to take care of his teenage nephew after the boy's father dies.,R,96.0,Drama_Crime,images\669.jpg,,True
"https://m.media-amazon.com/images/M/MV5BMWE2Y2E0ZTMtYzZmNi00MzZiLTg0ZTctMGY2YWJkMzE3NDEyXkEyXkFqcGc@._V1_QL75_UX180_CR0,4,180,266_.jpg",The Asphalt Jungle (1950),https://www.imdb.com/title/tt0042208/?ref_=sr_i_773,https://www.imdb.com/title/tt0042208/?ref_=sr_t_773,773. The Asphalt Jungle,1950,1h 52m,7.8,( 33K ),"A major heist goes off as planned, but then double crosses, bad luck and solid police work cause everything to unravel.",Approved,85.0,Drama_Crime,images\772.jpg,,True
"https://m.media-amazon.com/images/M/MV5BMDRlZWZjZjYtYzY2NS00ZWVjLTkwYzAtZTA2ZDAzMGRiYmYwXkEyXkFqcGc@._V1_QL75_UX180_CR0,2,180,266_.jpg","Robert De Niro, Sharon Stone, and Joe Pesci in Casino (1995)",https://www.imdb.com/title/tt0112641/?ref_=sr_i_163,https://www.imdb.com/title/tt0112641/?ref_=sr_t_163,163. Casino,1995,2h 58m,8.2,( 618K ),"In Las Vegas, two best friends--a casino executive and a Mafia enforcer--compete for a gambling empire and a fast-living, fast-loving socialite.",R,73.0,Drama_Crime,images\162.jpg,,True
"https://m.media-amazon.com/images/M/MV5BM2FiMmFkNWItNzNmOS00MWQ3LWExNTUtZWJkOTBmNzg0ZWRjXkEyXkFqcGc@._V1_QL75_UX180_CR0,4,180,266_.jpg",Cary Grant and Audrey Hepburn in Charade (1963),https://www.imdb.com/title/tt0056923/?ref_=sr_i_752,https://www.imdb.com/title/tt0056923/?ref_=sr_t_752,752. Charade,1963,1h 53m,7.8,( 93K ),Romance and intrigue ensue in Paris as a woman is pursued by several men who want to get their hands on a fortune her murdered husband had stolen. She soon loses trust in those who claim they want to help her.,Approved,83.0,Romance,images\751.jpg,,True
"https://m.media-amazon.com/images/M/MV5BMTg0NTIzMjQ1NV5BMl5BanBnXkFtZTcwNDc3MzM5OQ@@._V1_QL75_UY266_CR0,0,180,266_.jpg",Jake Gyllenhaal and Hugh Jackman in Prisoners (2013),https://www.imdb.com/title/tt1392214/?ref_=sr_i_153,https://www.imdb.com/title/tt1392214/?ref_=sr_t_153,153. Prisoners,2013,2h 33m,8.2,( 931K ),A desperate father takes the law into his own hands after police fail to find two kidnapped girls.,R,70.0,Horror_Thriller,images\152.jpg,,True
"https://m.media-amazon.com/images/M/MV5BYTUwY2EyMDktMGI0Ny00MDNlLWE0ODMtZWIwOGNhNmY1OWIwXkEyXkFqcGc@._V1_QL75_UX180_CR0,7,180,266_.jpg",Wings of Desire (1987),https://www.imdb.com/title/tt0093191/?ref_=sr_i_558,https://www.imdb.com/title/tt0093191/?ref_=sr_t_558,558. Wings of Desire,1987,2h 8m,7.9,( 84K ),"An angel meets Peter Falk, and loves a French trapeze artist in Berlin.",PG-13,79.0,Romance,images\557.jpg,,True
"https://m.media-amazon.com/images/M/MV5BZDNjNGVjZDctYzAwYi00ZWRhLWFhMmItNGZjZjAzNmE2MTIwXkEyXkFqcGc@._V1_QL75_UY266_CR4,0,180,266_.jpg",The Return (2003),https://www.imdb.com/title/tt0376968/?ref_=sr_i_573,https://www.imdb.com/title/tt0376968/?ref_=sr_t_573,573. The Return,2003,1h 50m,7.9,( 49K ),"In the Russian wilderness, two brothers face a range of new, conflicting emotions when their father - a man they know only through a single photograph - resurfaces.",Not Rated,82.0,Drama_Crime,images\572.jpg,,True
"https://m.media-amazon.com/images/M/MV5BMjQ0MTgyNjAxMV5BMl5BanBnXkFtZTgwNjUzMDkyODE@._V1_QL75_UX180_CR0,0,180,266_.jpg","Don Cheadle, Robert Downey Jr., Paul Bettany, Chris Evans, Scarlett Johansson, Elizabeth Olsen, Jeremy Renner, Anthony Mackie, Chadwick Boseman, and Sebastian Stan in Captain America: Civil War (2016)",https://www.imdb.com/title/tt3498820/?ref_=sr_i_676,https://www.imdb.com/title/tt3498820/?ref_=sr_t_676,676. Captain America: Civil War,2016,2h 27m,7.8,( 925K ),Political involvement in the Avengers' affairs causes a rift between Captain America and Iron Man.,PG-13,75.0,Romance,images\675.jpg,,True
"https://m.media-amazon.com/images/M/MV5BN2ZlMjIzZjctYzA2My00ZWYyLWI4ZjctMGI2NWYyNzFiZjAwXkEyXkFqcGc@._V1_QL75_UX180_CR0,2,180,266_.jpg",Jennifer Connelly in Requiem for a Dream (2000),https://www.imdb.com/title/tt0180093/?ref_=sr_i_112,https://www.imdb.com/title/tt0180093/?ref_=sr_t_112,112. Requiem for a Dream,2000,1h 42m,8.3,( 971K ),The drug-induced utopias of four Coney Island people are shattered when their addictions run deep.,NC-17,71.0,Drama_Crime,images\111.jpg,,True
"https://m.media-amazon.com/images/M/MV5BNWI1M2YxZWMtN2JiZi00MmJjLWE4NjgtODc2ODg2M2M5YWRiXkEyXkFqcGc@._V1_QL75_UY266_CR3,0,180,266_.jpg","Parvin Dabas, Anupam Kher, Kiran Juneja, Tara Sharma, Boman Irani, and Ranvir Shorey in Khosla Ka Ghosla! (2006)",https://www.imdb.com/title/tt0466460/?ref_=sr_i_227,https://www.imdb.com/title/tt0466460/?ref_=sr_t_227,227. Khosla Ka Ghosla!,2006,2h 15m,8.2,( 27K ),A Delhi-based retired middle-class man tries half-heartedly to get his land back from a swindling property dealer with the help of his sons and their friends.,Not Rated,,Drama_Crime,images\226.jpg,,True
"https://m.media-amazon.com/images/M/MV5BMWU4Y2I3YzItZWY1MC00ODRhLTljNWYtYmI0NWU0MzNiZmMwXkEyXkFqcGc@._V1_QL75_UX180_CR0,2,180,266_.jpg","James Stewart, Jean Arthur, Lionel Barrymore, and Edward Arnold in You Can't Take It with You (1938)",https://www.imdb.com/title/tt0030993/?ref_=sr_i_793,https://www.imdb.com/title/tt0030993/?ref_=sr_t_793,793. You Can't Take It with You,1938,2h 6m,7.8,( 30K ),The son of a snobbish Wall Street banker becomes engaged to a woman from a good-natured but decidedly eccentric family not realizing that his father is trying to force her family from their home for a real estate development.,Approved,,Animation_Family,images\792.jpg,,True
"https://m.media-amazon.com/images/M/MV5BM2MwMjNlNjctYjA2ZS00ZDA4LWJmNTYtODg5NDY1YzQzZDg2XkEyXkFqcGc@._V1_QL75_UY266_CR12,0,180,266_.jpg","Mohanlal, Meena, Ansiba Hassan, and Esther Anil in Drishyam (2013)",https://www.imdb.com/title/tt3417422/?ref_=sr_i_104,https://www.imdb.com/title/tt3417422/?ref_=sr_t_104,104. Drishyam,2013,2h 40m,8.4,( 48K ),A man goes to extreme lengths to save his family from punishment after the family commits an accidental crime.,Not Rated,,Animation_Family,images\103.jpg,,True
"https://m.media-amazon.com/images/M/MV5BYzg3MjBkYmYtZjZkZS00YWVkLTk3YjMtNDBlMTVmNDZkZDJhXkEyXkFqcGc@._V1_QL75_UX180_CR0,2,180,266_.jpg",Eva Whittaker and Honor Kneafsey in Wolfwalkers (2020),https://www.imdb.com/title/tt5198068/?ref_=sr_i_422,https://www.imdb.com/title/tt5198068/?ref_=sr_t_422,422. Wolfwalkers,2020,1h 43m,8.0,( 45K ),A young apprentice hunter and her father journey to Ireland to help wipe out the last wolf pack. But everything changes when she befriends a free-spirited girl from a mysterious tribe rumored to transform into wolves by night.,PG,87.0,Drama_Crime,images\421.jpg,,True
"https://m.media-amazon.com/images/M/MV5BZjcyMjg2MzktNjg4YS00MjQzLTg0YWQtMjUyZDk2Y2Y0YzZjXkEyXkFqcGc@._V1_QL75_UX180_CR0,0,180,266_.jpg",Castle in the Sky (1986),https://www.imdb.com/title/tt0092067/?ref_=sr_i_420,https://www.imdb.com/title/tt0092067/?ref_=sr_t_420,420. Castle in the Sky,1986,2h 4m,8.0,( 198K ),"Pazu's life changes when he meets Sheeta, a girl whom pirates are chasing for her crystal amulet, which has the potential to locate Laputa, a legendary castle floating in the sky.",PG,78.0,Drama_Crime,images\419.jpg,,True
"https://m.media-amazon.com/images/M/MV5BZTA3OWVjOWItNjE1NS00NzZiLWE1MjgtZDZhMWI1ZTlkNzYwXkEyXkFqcGc@._V1_QL75_UX180_CR0,1,180,266_.jpg","Tom Hanks, R. Lee Ermey, Tim Allen, Annie Potts, John Ratzenberger, Wallace Shawn, Jim Varney, and Don Rickles in Toy Story (1995)",https://www.imdb.com/title/tt0114709/?ref_=sr_i_120,https://www.imdb.com/title/tt0114709/?ref_=sr_t_120,120. Toy Story,1995,1h 21m,8.3,( 1.2M ),"A cowboy doll is profoundly jealous when a new spaceman action figure supplants him as the top toy in a boy's bedroom. When circumstances separate them from their owner, the duo have to put aside their differences to return to him.",G,96.0,Sci_Fi,images\119.jpg,,True
"https://m.media-amazon.com/images/M/MV5BMTYxNDA3MDQwNl5BMl5BanBnXkFtZTcwNTU4Mzc1Nw@@._V1_QL75_UX180_CR0,0,180,266_.jpg",François Cluzet and Omar Sy in The Intouchables (2011),https://www.imdb.com/title/tt1675434/?ref_=sr_i_54,https://www.imdb.com/title/tt1675434/?ref_=sr_t_54,54. The Intouchables,2011,1h 52m,8.5,( 1M ),"After he becomes a quadriplegic from a paragliding accident, an aristocrat hires a young man from the projects to be his caregiver.",R,57.0,Drama_Crime,images\53.jpg,,True
"https://m.media-amazon.com/images/M/MV5BMjA5Njk3MjM4OV5BMl5BanBnXkFtZTcwMTc5MTE1MQ@@._V1_QL75_UY266_CR1,0,180,266_.jpg",Javier Bardem and Josh Brolin in No Country for Old Men (2007),https://www.imdb.com/title/tt0477348/?ref_=sr_i_152,https://www.imdb.com/title/tt0477348/?ref_=sr_t_152,152. No Country for Old Men,2007,2h 2m,8.2,( 1.2M ),Violence and mayhem ensue after a hunter stumbles upon the aftermath of a drug deal gone wrong and over two million dollars in cash near the Rio Grande.,R,92.0,Drama_Crime,images\151.jpg,,True
"https://m.media-amazon.com/images/M/MV5BOWE3MjQ3ZDAtNDQ2MC00YjBjLTk0ZWYtNjQ0YzQ4YWE3YTEyXkEyXkFqcGc@._V1_QL75_UX180_CR0,1,180,266_.jpg",Bill Murray and Andie MacDowell in Groundhog Day (1993),https://www.imdb.com/title/tt0107048/?ref_=sr_i_404,https://www.imdb.com/title/tt0107048/?ref_=sr_t_404,404. Groundhog Day,1993,1h 41m,8.0,( 736K ),A curmudgeonly weatherman finds himself stuck in a time loop and is forced to relive the same day over and over again.,PG,72.0,Drama_Crime,images\403.jpg,,True
"https://m.media-amazon.com/images/M/MV5BMTUwMzc1NjIzMV5BMl5BanBnXkFtZTgwODUyMTIxMTE@._V1_QL75_UY266_CR1,0,180,266_.jpg",Irrfan Khan and Nimrat Kaur in The Lunchbox (2013),https://www.imdb.com/title/tt2350496/?ref_=sr_i_754,https://www.imdb.com/title/tt2350496/?ref_=sr_t_754,754. The Lunchbox,2013,1h 44m,7.8,( 68K ),A mistaken delivery in Mumbai's famously efficient lunchbox delivery system connects a young housewife to an older man in the dusk of his life as they build a fantasy world together through notes in the lunchbox.,PG,76.0,Drama_Crime,images\753.jpg,,True
"https://m.media-amazon.com/images/M/MV5BMTEyZTQ4YWItMzNkNi00MTUwLWEyODAtMWI3NDNhNDRiYmQwXkEyXkFqcGc@._V1_QL75_UY266_CR4,0,180,266_.jpg",Aras Bulut Iynemli and Nisa Sofiya Aksongur in Miracle in Cell No. 7 (2019),https://www.imdb.com/title/tt10431500/?ref_=sr_i_208,https://www.imdb.com/title/tt10431500/?ref_=sr_t_208,208. Miracle in Cell No. 7,2019,2h 12m,8.2,( 62K ),A story of love between a mentally-ill father who was wrongly accused of murder and his lovely six year old daughter. Prison will be their home. Based on the 2013 Korean movie Miracle in Cell No. 7 (2013).,TV-14,,Romance,images\207.jpg,,True
"https://m.media-amazon.com/images/M/MV5BYjQyMTNhNjUtN2VmYy00NWRhLTkwOTctMGVmNTBmNDIxYjZhXkEyXkFqcGc@._V1_QL75_UX180_CR0,0,180,266_.jpg",Teo Yoo and Greta Lee in Past Lives (2023),https://www.imdb.com/title/tt13238346/?ref_=sr_i_678,https://www.imdb.com/title/tt13238346/?ref_=sr_t_678,678. Past Lives,2023,1h 45m,7.8,( 172K ),"Nora and Hae Sung, two deeply connected childhood friends, are wrested apart after Nora's family emigrates from South Korea. Twenty years later, they are reunited for one fateful week as they confront notions of love and destiny.",PG-13,94.0,Romance,images\677.jpg,,True
"https://m.media-amazon.com/images/M/MV5BY2IwZmU2YWQtMjU3MS00Mjg1LWJkMjYtYzA0ZjliYzk1Mzg1XkEyXkFqcGc@._V1_QL75_UX180_CR0,2,180,266_.jpg","Myrna Loy, Maureen O'Sullivan, and William Powell in The Thin Man (1934)",https://www.imdb.com/title/tt0025878/?ref_=sr_i_619,https://www.imdb.com/title/tt0025878/?ref_=sr_t_619,619. The Thin Man,1934,1h 31m,7.9,( 35K ),"Former detective Nick Charles and his wealthy wife Nora investigate a murder case, mostly for the fun of it.",TV-PG,86.0,Horror_Thriller,images\618.jpg,,True
"https://m.media-amazon.com/images/M/MV5BNzIxMDQ2YTctNDY4MC00ZTRhLTk4ODQtMTVlOWY4NTdiYmMwXkEyXkFqcGc@._V1_QL75_UX180_CR0,0,180,266_.jpg","Liv Tyler, Sean Astin, Sean Bean, Elijah Wood, Cate Blanchett, Viggo Mortensen, Ian McKellen, Orlando Bloom, Billy Boyd, Dominic Monaghan, and John Rhys-Davies in The Lord of the Rings: The Fellowship of the Ring (2001)",https://www.imdb.com/title/tt0120737/?ref_=sr_i_9,https://www.imdb.com/title/tt0120737/?ref_=sr_t_9,9. The Lord of the Rings: The Fellowship of the Ring,2001,2h 58m,8.9,( 2.2M ),A meek Hobbit from the Shire and eight companions set out on a journey to destroy the powerful One Ring and save Middle-earth from the Dark Lord Sauron.,PG-13,92.0,Horror_Thriller,images\8.jpg,,True
"https://m.media-amazon.com/images/M/MV5BZDZkNDQ3YjktYjBlZC00YTY1LTgxOGYtY2RhMWFhZmNkZGY3XkEyXkFqcGc@._V1_QL75_UX180_CR0,7,180,266_.jpg","Brad Pitt, Christian Bale, Steve Carell, and Ryan Gosling in The Big Short (2015)",https://www.imdb.com/title/tt1596363/?ref_=sr_i_652,https://www.imdb.com/title/tt1596363/?ref_=sr_t_652,652. The Big Short,2015,2h 10m,7.8,( 538K ),"Prior to the 2008 financial crisis, a group of investors bet against the US mortgage market and are stunned by the corruption they uncover through their research.",R,81.0,Drama_Crime,images\651.jpg,,True
